NAME_(ENG),ALT NAMES,REF1,REF2,OBLAST,COUNTRY,IMGQUAL,ICAO,ICAOR,ICAOSRC,CAT,SIG,LATD,LATM,LATS,LOND,LONM,LONS,SRCLATLON (G=GoogleLowRes H=GoogleHighRes X=not found),ELEV1FT,ELEV1SRC,ELEV2FT,ELEV2SRC,ELEV3FT,ELEV3SRC,LAT,LON,MAG2010,R1L,R1W,R1DIMSRC (G=googlelowres H=googlehighres),R1HDG,R1NAM,R1SFC,R2LEN,R2WID,R2DIMSRC,R2HDG,R2OVRUNNE,R2OVRUNSW,R2NAM,R2SFC,R2dg,R2len,USE,OPR,MILPURPOSECODE,UNITS,NOTES,
Aktau,,25 km N,Mangyslak,,KAZ,,UATE,,CD,M,,43,51.6,N,51,5.5,E,CD,72,CD,,,,,43.86,51.0917,6,2656,45,CD,122,Dec-30,ASPH,,,,,,,,,,,CIV,,,Civilian,Civilian.  Services Tu-154 and Il-76 aircraft.  Located along eastern shore of Caspian Sea.  24-hour operations (DAFIF).,
Uzen,,5 km E,Uzen,,KAZ,,,,,M,,43,20.7,N,52,56,E,H,650,,,,,,43.345,52.9333,6,1550,40,H,139,13/31,ASPH,,,,,,,,,,,CIV,,,Civilian,Appears to service gas production area.,
Kungrad,,,,Uzbekistan,UZB,,,,,M,,43,5,N,58,53.1,E,W,180,W,,,,,43.0833,58.885,6,1437,30,W,2,18/36,ASPH,,,,,,,,,,,CIV,,,Civilian,Civilian airfield.,
Muynak,,1 km S,Muynak,Uzbekistan,UZB,,,,,M,,43,45.3,N,59,1.9,E,W,177,W,,,,,43.755,59.0317,6,1513,30,W,49,Apr-22,ASPH,,,,,,,,,,,CIV,,,Civilian,Civilian airfield in southern marsh of Aral Sea.,
Turkestan/Kentau,,12 km NE,Turkestan,,KAZ,,UAJT,,,M,,43,19.3,N,68,24.1,E,G,810,,,,,,43.3217,68.4017,,1800,35,G,57,May-23,ASPH,,,,,,,,,,,CIV,,,Civilian,Services small airliners.,
Turkestan/Southwest,,4 km SW,Turkestan,,KAZ,,,,,A,0,43,16.2,N,68,11.3,E,H,668,H,,,,,43.27,68.1883,,1700,30,H,59,,????,,,,,,,,,,,-,,,Abandoned,"Abandoned civilian airfield, only faint remains of one small runway can be seen.",
Karataw,Karataw Northeast (US),4 km NE,Karatau,,KAZ,,,,,M,2,43,12.2,N,70,30.4,E,H,1683,,,,,,43.2033,70.5067,,665,30,H,51,,CONC,,,,,,,,,,,CIV,,,Civilian,Minor civilian airfield with tarmac.,
Karataw/Old,,4 km N,Karatau,,KAZ,,,,,A,,43,12.4,N,70,30.2,E,H,0,,,,,,43.2067,70.5033,,2000,40,H,62,,CONC,,,,,,,,,,,,,,,Abandoned military airfield; demolished.,
Bishkek/Manas,,22 km NW,Bishkek,,KAZ,,UAFM,,CD,M,,43,3.7,N,74,28.7,E,CD,2057,D,,,,,43.0617,74.4783,5,4200,55,CD,80,Aug-26,CONC,,,,,,,,,,,CIV/MIL,,,Mixed use.,"Civilian; 22 parking spaces near terminal and services up to the largest types of airliners.  Also military use.  Only 11 km from border with Uzbekistan (?).  U.S. Air Force uses this facility.  CAICA 2000 gave elevation as 637 m.  In July 2005 after the U.S. Air Force was ousted from Uzbekistan, Manas took the overflow of cargo.",
Almaty/North,Alma Ata North (US),12 km N,Almaty,,KAZ,,,,,M,0,43,22.3,N,76,58.5,E,H,2149,,,,,,43.3717,76.975,,1800,30,G,14,,DIRT,,,,,,,,,,,-,,,,Concrete runway demolished but dirt runway still remains.  Facility has numerous concrete pads and a large number of helicopters.,
Almaty/Burundai?,Alma Ata Northwest (US),10 km NW,Almaty,,KAZ,,,,,M,,43,21.1,N,76,52.9,E,H,2201,,,,,,43.3517,76.8817,,1300,36,H,24,Feb-20,CONC,,,,,,,,,,,CIV/MIL,,,"Military (An-24,An-26).",An24/26/30 base. Entry thanks to AviaMK. ,
Nikolayevka,"Ilysk, Ilysk South (US)",50 km N,Almaty,,KAZ,,,,,M,6,43,43.9,N,77,7.2,E,H,1647,,,,,,43.7317,77.12,,2500,40,H,15,Jan-19,CONC,,,,,,,,,,,MIL,,IA,Interceptor/attack,Large interceptor/attack airfield.  It was home to 149 Gv BAP flying Yak-28 bombers in the 1960s[#34].,
Almaty,,14 km NE,Almaty,,KAZ,,UAAA,,CD,M,7,43,21.1,N,77,2.4,E,CD,2234,CD,,,,,43.3517,77.04,4,4398,45,CD,56,May-23,ASPH,,,,,,,,,,,CIV,,,Civilian,Large civilian airport with 63 parking spaces near main terminal.  Some military aircraft base/stored.  Avia.ru site gives width of 56 m.,
Chilik,,131 km NW,Almaty,,KAZ,,,,,A,,43,40,N,78,24.6,E,G,1854,G,,,,,43.6667,78.41,,3000,30,G,75,,CONC,,,,,,,,,,,???,,,,Airfield indicated on GNC-13 but location doubtful due to poor satellite imagery.  Airfield probably abandoned decades ago.,
Chilik Southeast,,145 km E,Almaty,,KAZ,,,,,H,,43,13.4,N,78,43.3,E,G,4505,G,,,,,43.2233,78.7217,,3000,30,G,71,,ASPH,,,,,,,,,,,,,,,Major highway strip with turnouts.  Unable to see many details due to poor satellite imagery.,
Kokpek Highway Strip,Kokpek East (US),51 km SE,Selek,,KAZ,,,,,M,1,43,26.5,N,78,51.5,E,G,3501,,,,,,43.4417,78.8583,,3000,30,G,73,,ASPH,,,,,,,,,,,MIL,,,Military,"Highway strip; two reveted areas, one parallel strip.",
Chundhza,,8 km NW,Chundhza,,KAZ,,,,,M,-,43,35.9,N,79,25.7,E,G,3008,,,,,,43.5983,79.4283,,2000,40,G,17,,CONC,,,,,,,,,,,MIL,,,Military,"Appears to be an abandoned 1950s-era airfield.  Parallel taxiway.  Only about 100 km from Chinese border, so probably served as a front-line defense for Alma Ata against Urumqi-region attacks.",
Vozdvizhenka,"Ussuriysk, Ussuriysk Vozdvizhenka (US)",13 km N,Ussuriysk,Primorski,RUS,9,UH3X,,,M,8,43,54.4,N,131,55.5,E,H,108,,,,,,43.9067,131.925,-10,3000,40,G,18,Mar-21,CONC,,,,,,,,,,,MIL,"FA,DA",BA,"523 APIB (Su-17M3/M4, 1975, 1988, 1991)[#4], under 1st Air Army (Far East).  444 TBAP (Tu-16, 1956, 1975, 1991)[#2] (Tu-16K, 1975-?).  (Il-28, 1975).",Medium-sized air base near Mikhailovka.  Runway reportedly upgraded 1987.  Major nuclear bomber base (sister of Khorol).  Long runway and curved taxiways with large revetments.  Runway width is 60 m but only 40 m is usable.  APIB under 1st Air Army Far East.,
Korsakovka,,8 km W,Borisovka,Primorski,RUS,4,,,,N,1,43,48,N,131,42.2,E,G,115,T,,,,,43.8,131.7033,-10,675,30,G,65,Jul-25,DIRT,,,,,,,,,,,CIV,,,Civilian,Small agricultural or town airstrip.  No buildings onsite.,
Novonikolsk,,,,,RUS,8,,,,x,,43,52,N,131,52,E,X,131,J,,,,,43.8667,131.8667,,,,,,,,,,,,,,,,,,???,,,,"Military airfield listed on 1980 JNC chart.  Unable to precisely locate on satellite imagery due to snow cover, but traces of a dirt airstrip visible on declassified imagery from 1967.",
Sukhaya Rechka,,31 km SW,Vladivostok,Primorski,RUS,4,,,,A,0,43,1.7,N,131,32.5,E,G,66,,,,,,43.0283,131.5417,-10,1500,30,G,59,Jul-25,????,,,,,,,,,,,-,,,Abandoned,Airfield southwest of Vladivostok had tarmacs and taxiways and may have been a 1940s or 1950s air base.  Demolished but geometrics are still visible.,
Mikhaylovka South,Mikhailovka,3 km SE,Mihajlovka,Primorski,RUS,8,,,,A,0,43,54.1,N,132,2,E,G,128,,,,,,43.9017,132.0333,-10,2000,30,G,37,May-23,????,,,,,,,,,,,-,,,Abandoned,Abandoned military airfield.  Covered by snow in Google Earth imagery.,
Ussuriysk Southeast,,7 km SE,Ussuriysk,Primorski,RUS,8,,,,A,0,43,44.9,N,132,0.6,E,G,157,T,,,,,43.7483,132.01,-10,1750,45,G,132,14/28,????,,,,,,,,,,,-,,,Military,"Appears to be a large abandoned military base, probably a fighter base from the 1950s or 1960s.",
Maykhe,,20 km NE,Artem,Primorski,RUS,9,,,,A,0,43,25.4,N,132,25.4,E,G,95,,,,,,43.4233,132.4233,-10,2000,35,G,41,May-23,CONC,,,,,,,,,,,-,,,Abandoned,Abandoned military airfield in severe disrepair.  Runway width is 60 m but only 35 m is reinforced and marked.,
Vladivostok/Knevichi,,5 km N,Artem,Primorski,RUS,,UHWW,,CD,M,8,43,23.9,N,132,9.1,E,D,46,D,,,,,43.3983,132.1517,-10,3500,60,D,61,07L/25R,CONC,,,,,,,,,,,CIV/MIL,,R,141 MRAP (Tu-22M2).,"Vladivostok's international airport.  Handles all aircraft sizes; 22 parking spots.  Fighter revetments appear to be decaying, but a remote revetment area with 11 concrete pads exists.  Rwy 07R/25L closed.",
Uglovoe,"Uglovoye Northwest (US), Uglovaya, Uglovoye",4 km W,Uglovoye,Primorski,RUS,9,UH2X,,,M,6,43,20.9,N,132,3.5,E,H,95,,,,,,43.3483,132.0583,-10,2450,35,H,25,Mar-21,CONC,,,,,,,,,,,MIL,PVO,I,"22 GV IAP (MiG-23, 1991)[#1] (Su-27)[#7].",,
Pristan,"Romanovka East (US), Smolyaninovo",14 km N,Bolshoi Kamen,Primorski,RUS,9,UH1X,,,M,5,43,14.6,N,132,19.6,E,G,13,,,,,,43.2433,132.3267,-10,2500,60,H,14,Feb-20,CONC,,,,,,,,,,,MIL,FA,A,"173 OMSHAP (Su-17, 1992)[#3], (Su-24MR, 1992)[#3].  311 OKSHAP (Yak-38, 1992)[#3].",Isolated base 20 miles east of Vladivostok appears to be a forward operating location with about 15 hardened revetments and some tarmac space.  150 m runway overrun each side.,
Novorossiya,,5 km W,Novorossiya,Primorski,RUS,,,,,M,5,43,20.9,N,132,33.4,E,G,394,J8,,,,,43.3483,132.5567,,2000,30,G,88,,CONC,,,,,,,,,,,?,,,,Military combat base.  Unknown status.  Name Novorossiya is as given on 1980 JNC chart.,
UNKNOWN,,2 km W,Novonezhino,Primorski,RUS,,,,,M,,43,13.2,N,132,34.7,E,G,262,G,,,,,43.22,132.5783,,460,40,G,103,,CONC,,,,,,,,,,,?,,,,Military combat base.  Original runway length appears to have been 970 m with possible planned extension to 1800 m.  Contains a few helicopters and some utility planes.,
Nikolayevka,,2 km SW,Nikolayevka,Primorski,RUS,,UHN1,,,M,7,43,5.1,N,133,11.5,E,G,207,,,,,,43.085,133.1917,-10,2800,60,G,27,Apr-22,CONC,,,,,,,,,,,MIL,,E,"77 OPLAPDD (Il-38, 1992)[#3].  289 OPLAP (Be-12, 1992)[#3].","Medium air base 37 km NE of Nakhodka.  Sprawling base with remote revetment area and loop revetment, harboring a total of 30 large spaces and about 10 smaller ones.  No tarmac space.  During WWII Yak-3s were based here.",
Sergeyevka South,,5 km S,Sergeyevka,Primorski,RUS,,,,,M,2,43,18.3,N,133,20.7,E,G,492,J8,,,,,43.305,133.345,,950,40,G,27,,CONC,,,,,,,,,,,CIV,,,Civilian,Minor civilian airfield with paved runway.,
Serafimovka,,7 km N,Serafimovka,Primorski,RUS,,,,,M,0,43,54.5,N,135,13.5,E,G,400,J8,,,,,43.9083,135.225,,1500,30,G,151,,CONC,,,,,,,,,,,-,,,Unknown,"Appears to be an abandoned construction project for a combat fighter base covering southeastern Primorski Kray.  Listed on 1980 JNC chart as ""abandoned"".",
Yuzhno-Kurilsk,"Mendeleyevo, Sernovodsk",17 km SW,Yuzhno-Kurilsk,Sakhalinsk,RUS,,UHSM,,C,M,5,43,57.6,N,145,41.1,E,G,499,J,,,,,43.96,145.685,,2120,36,G,3,Jan-19,CONC,,,,,,,,,,,CIV,,,Civilian,"Small civilian airfield located on Ostrov Kunashir.  One small parking apron.  This is the closest airfield to Japan, at a distance of only 50 km.  Listed as Sernovodsk on US DoD GNC-6 (1977).",
Sukhumi/Babushara,"Dranda (US), Sukhumi",18 km SE,Sukhumi,Georgia,GEO,,UGSS,,,M,7,42,51.5,N,41,7.6,E,G,52,,,,,,42.8583,41.1267,5,3661,60,G,123,Dec-30,CONC,,,,,,,,,,,CIV/MIL,,,Mixed,Civilian airport; terminal area parks 6 medium/large aircraft and 31 smaller planes.  Joint use airfield (DAFIF).,
Tsulukidze,,4 km SW,Khoni,Georgia,GEO,,,,,M,,42,18.4,N,42,22.6,E,G,,,,,,,42.3067,42.3767,5,1850,30,G,86,,ASPH,,,,,,,,,,,MIL,,,Military,Former military airfield with about 30 revetments along angular system of taxiways.  Neglected appearance and substandard runway length indicates this is 1950s-1960s era.  May be a civilian airfield now.  Not on ONC or JNC charts.,
Kutaisi West,,7 km W,Kutaisi,Georgia,GEO,,,,,M,,42,14.9,N,42,37.5,E,G,384,,,,,,42.2483,42.625,5,1430,40,G,95,Sep-27,ASPH,,,,,,,,,,,CIV,,,Civilian,,
Mikha-Tskhakaya,,3 km S,Senaki,Georgia,GEO,,,,,M,,42,14.4,N,42,3,E,H,49,,,,,,42.24,42.05,5,2400,80,H,95,Sep-27,ASPH,,,,,,,,,,,CIV,,,,Military combat airfield with numerous aircraft shelters.  Appears to be starting to decay.,
Kopitnari,Samtredia East (US),11 km E,Samtredia,Georgia,GEO,,UGKO,,D,M,,42,10.6,N,42,29,E,D,223,D,,,,,42.1767,42.4833,5,2500,44,D,81,Aug-26,CONC,,,,,,,,,,,CIV,,,,This was a military base that was home to 143 BAP flying Yak-28 Brewer bombers[#34].,
Tskhinvali South,,5 km S,Tskhinvali,Georgia,GEO,,,,,M,,42,11.3,N,43,56.5,E,G,2402,,,,,,42.1883,43.9417,,1700,40,G,58,,CONC,,,,,,,,,,,-,,,,Pasture now occupies the site of a 1950s-1960s era airfield.  Runway is demolished.  Some revetments still stand and it may serve as a helicopter facility.,
Makhachkala/Uytash,Uytash,7 km S,Kaspiysk,Dagestan,RUS,,URML,,CD,M,,42,49,N,47,39.1,E,D,13,D,,,,,42.8167,47.6517,6,2640,42,D,149,14/32,CONC,,,,,,,,,,,CIV,,,Civilian,Handles medium-sized airliner traffic. Parking for 4 jets and dozens of smaller aircraft.,
Nukus,,4 km NE,Nukus,Uzbekistan,UZB,,UTNR,,D,M,,42,29.3,N,59,37.4,E,W,246,W,,,,,42.4883,59.6233,6,2797,49,W,155,15/33,CONC,,,,,,,,,,,MIL/CIV,,,Mixed.,Joint civil-military airfield.  Different source gave ICAO of UTNN.,
Nukus/South,,13 km SW,Nukus,Uzbekistan,UZB,,,,,M,,42,21.9,N,59,30.7,E,H,233,,,,,,42.365,59.5117,6,2600,56,H,138,,CONC,,,,,,,,,,,MIL,,,Military,Decaying military airfield.,
Uchkuduk,,,,Uzbekistan,UZB,,,,,M,,42,5,N,63,27,E,W,417,W,,,,,42.0833,63.45,5,1476,35,W,91,Sep-27,ASPH,,,,,,,,,,,CIV,,,Civilian,Appears runway may have originally been 4000 m and was broken up into smaller portions.,
Chimkent/Khatynkopir,Shymkent,11 km NW,Simkent,,KAZ,,UAII,,CD,M,6,42,21.9,N,69,28.7,E,CD,1384,CD,,,,,42.365,69.4783,5,2800,44,CD,106,Oct-28,CONC,,,,,,,,,,,CIV/MIL,,R,"Mixed.  317 ORAP (Su-17,1988) under 73rd Air Army.",Civilian tarmac servicing medium-sized airliners.  Some fighter revetments.  ((73rd Air Army Central Asia)),
Chimkent/Sayram,Sayram,7 km E,Sayram,,KAZ,,,,,N,0,42,17.5,N,69,50.9,E,H,2457,,,,,,42.2917,69.8483,5,2290,40,G,85,,????,,,,,,,,,,,-,,,Demolished,"Almost no trace remains of this former airfield.  It appears to have had a 2 km runway.  Some Li-2s are based here, suggesting that a dirt airstrip is still being used.",
Taraz/Auliye-Ata,Dzhambul (US),9 km SW,Taraz,,KAZ,,UADD/UA37,,D,M,,42,51.2,N,71,18.2,E,D,2185,D,,,,,42.8533,71.3033,5,2900,45,D,137,13/31,ASPH,,,,,,,,,,,CIV/MIL,FA,A,Mixed use.,Numerous revetments.  Services medium-sized airliners.,
Lugovoe,Lugovoy (US),7 km N,Lugovoye,,KAZ,,,,,M,,42,58.4,N,72,43.6,E,W,2129,W,,,,,42.9733,72.7267,5,3000,45,W,88,08L/26R,CONC,,,,,,,,,,,MIL,FA,A,715 IAP (MiG-23M).,Possible bomber airfield; double taxiways with considerable tarmac space and no revetments.  Being used as a storage area for MiG-23s[18].,
Talas,,2 km SE,Talas,,KAZ,,,,,M,2,42,30.3,N,72,15.8,E,G,4153,,,,,,42.505,72.2633,,1700,35,G,101,Oct-28,CONC,,,,,,,,,,,CIV,,,Civilian,Probably a civilian airfield.,
Bishkek/Kant,Frunze,4 km S,Kant,,KAZ,,UAFW,,D,M,,42,51.2,N,74,50.8,E,D,2549,D,,,,,42.8533,74.8467,5,2700,50,D,115,Nov-29,CONC,,,,,,,,,,,CIV/MIL,,,Civilian/military.,,
Tokmak,,3 km E,Tokmak,Krgyzystan,KGZ,,,,,M,,42,49.7,N,75,20.2,E,H,2762,,,,,,42.8283,75.3367,,3025,60,H,97,Sep-27,CONC,,,,,,,,,,,???,,,Unknown,Possible civilian/military.,
Chok Tal,"Tamchy (US), Ysykkul",47 km E,Balykchy,Krgyzystan,KGZ,,UAFL,,W,M,2,42,35.3,N,76,42.8,E,W,5423,W,,,,,42.5883,76.7133,4,2000,45,W,74,Jul-25,CONC,,,,,,,,,,,CIV,,,Civilian,Civilian airfield (DAFIF).  Large ramp.,
Rybach'ye/Chu,"Issyk-Kull, Balykchy",6 km SW,Rybach'ye,Krgyzystan,KGZ,,,,,N,0,42,25.6,N,76,7.2,E,H,5328,,,,,,42.4267,76.12,,1700,100,H,33,,DIRT,,,,,,,,,,,-,,,Abandoned,Barely visible.,
Cholponata,"Cholpon Ata, Cholpon-Ata",2 km W,,Krgyzystan,KGZ,,UAFG,,,N,0,42,39,N,77,3.5,E,G,5617,,,,,,42.65,77.0583,,1740,40,G,162,16/34,DIRT,,,,,,,,,,,-,,,Abandoned,Probably a former utilitarian airfield.,
Tamga,,1 km E,Barskoon,Krgyzystan,KGZ,,UAFA,,,N,2,42,8.8,N,77,33.8,E,,5613,,,,,,42.1467,77.5633,,850,175,G,181,18/36,GRAV,,,,,,,,,,,CIV,,,Civilian,Small civilian airfield with packed gravel runway.,
Przhevalsk,Karakol,3 km NW,Karakol,Krgyzystan,KGZ,,UAFP,,D,M,0,42,30.5,N,78,24.5,E,H,5584,,,,,,42.5083,78.4083,,2000,34,H,104,Oct-28,CONC,,,,,,,,,,,-,,,,Minor civil airstrip.,
Kraskino Southeast,,9 km SE,Baranovka,Primorski,RUS,,,,,N,-,42,38.5,N,130,57.7,E,X,299,J,,,,,42.6417,130.9617,,750,50,G,167,,DIRT,,,,,,,,,,,CIV,,,Abandoned,Location doubtful.  Appears to be an old abandoned dirt airstrip.,
Zolotaya Dolina,Unashi (US),14NE,Nakhodka,Primorski,RUS,,UHU1,,,M,,42,57.6,N,133,6.9,E,G,259,,,,,,42.96,133.115,-10,2500,45,G,27,Apr-22,CONC,,,,,,,,,,,MIL,PVO,I,"47 IAP (Su-27, 1991)[#1]",This base has a few long taxiways with a few revetments.,
Makharadze,,11 km W,Ozurgeti,,GEO,,,,,M,1,41,55.7,N,41,51.8,E,G,98,,,,,,41.9283,41.8633,5,2350,40,G,76,,CONC,,,,,,,,,,,MIL,,,Military,"Airfield looks somewhat abandoned.  Is the closest airfield to Turkey along the Black Sea coast, except for Batumi.",
Batumi/Chorokh,,6 km SW,Batumi,,GEO,,UGSB,,CD,M,,41,36.6,N,41,36,E,CD,105,C,,,,,41.61,41.6,5,2233,46,D,132,13/31,ASPH,,,,,,,,,,,CIV,,,Civilian,"Civilian airport servicing small airliners (Tu-134, etc).",
Akhalkalaki,,3 km S,Akhalkalaki,,GEO,,,,,A,1,41,22.6,N,43,28.8,E,H,5686,,,,,,41.3767,43.48,5,2500,40,H,167,,????,,,,,,,,,,,-,,,Abandoned,"Now an agricultural field, the remains of an old airfield can be seen on satellite imagery.",
Tbilisi/Lochini,"Lochini, Novo Alekseyevka (US), Novoalexeyevka",14 km E,Tbilisi,,GEO,,UGGG,,CD,M,,41,40.2,N,44,57.3,E,CD,1624,CD,,,,,41.67,44.955,5,3000,45,CD,137,13R/31L,CONC,,,,,,,,,,,CIV,,,Civilian,Services large airliners; terminal area parks 22 medium/large aircraft and 28 small aircraft.,
Tbilisi/Soganlug,,15 km SE,Tbilisi,,GEO,,,,,M,1,41,39,N,44,56.2,E,H,1250,,,,,,41.65,44.9367,5,2478,80,H,140,14/32,CONC,,,,,,,,,,,MIL,,,Military,Airfield is abandoned or in poor condition.  Located only 3 km southwest of Tbilisi Lochini civilian airport.,
Sandar,,2 km S,Marneuli,Marneuli,GEO,,,,,M,,41,27.5,N,44,47,E,G,1306,,,,,,41.4583,44.7833,5,2490,40,G,91,Sep-27,CONC,,,,,,,,,,,MIL,PVO,I,166 GV IAP[#1] (40 Su-15TM).,Minor military airfield 28 km south of Tbilisi with small tarmac space.,
Stepanavan,Kalilino,6 km NW,Stepanavan,,ARM,,UDLS,,D,M,,41,2.9,N,44,20.2,E,D,4836,,,,,,41.0483,44.3367,5,1998,28,D,131,13/31,ASPH,,,,,,,,,,,CIV,,,Civilian,This appears to be the western side of Stepanavan/Kalilino.,
Telavi Kurdgelauri,,5 km NE,Telavi,,GEO,,,,,M,,41,57.2,N,45,30.5,E,H,1489,,,,,,41.9533,45.5083,5,1692,35,H,102,Oct-28,ASPH,,,,,,,,,,,CIV,,,Civilian,Small civilian airstrip.,
Vaziani,,22 km SE,Tbilisi,Tbilisi,GEO,,,,,M,,41,37.7,N,45,1.8,E,H,1499,,,,,,41.6283,45.03,5,2501,60,H,143,14/32,CONC,,,,,,,,,,,MIL,,,Military,"Located 5 miles east of Tbilisi airport, this is a military base with numerous revetments.  Its status is unknown, though satellite indicates some overgrowth.  Military (DAFIF).",
Akstafa,,3 km NW,Akstafa,Azerbaijan,AZE,,,,,M,,41,7.4,N,45,25.4,E,W,1079,W,,,,,41.1233,45.4233,5,2163,35,W,106,Oct-28,ASPH,,,,,,,,,,,CIV,,,Civilian,Small civilian airfield.,
Belokany,,3 km W,Belakan,,AZE,,,,,M,,41,45.2,N,46,21.3,E,W,935,W,,,,,41.7533,46.355,5,1209,37,W,138,13/31,ASPH,,,,,,,,,,,CIV,,,Civilian,Added thanks to DAFIF.,
Zakataly,,8 km S,Zakataly,Azerbaijan,AZE,,,,,M,3,41,33.7,N,46,40,E,G,1499,,,,,,41.5617,46.6667,5,1750,30,G,159,,ASPH,,,,,,,,,,,CIV,,,Civilian,Civil Terminals northwest and east; large IL76 base air base with some revetments on west and southwest; civil Il-76 storage on northeast ramp (AviaMK).  Well-maintained asphalt runway.,
Zemo Kedi,"Zemo-Kedi, Bolshiye Shiraki (US)",5 km SW,Zemo-Kedi,Georgia,GEO,,,,,M,6,41,22.8,N,46,22.1,E,H,1795,,,,,,41.38,46.3683,5,2701,60,H,136,13/31,CONC,,,,,,,,,,,MIL,FA,A,Attack,Large forward-deployment attack airfield.  About 50 revetments with hardened shelters along several angular taxiways.  Georgia's most easterly military airfield.,
Sheki,,7 km S,Sheki,Azerbaijan,AZE,,,,,M,2,41,8.1,N,47,9.6,E,G,1499,,,,,,41.135,47.16,5,1550,30,G,165,,ASPH,,,,,,,,,,,CIV,,,Civilian,Utilitarian civilian airstrip.,
Bekdash,,3 km E,Bekdash,,TKM,,,,,M,3,41,32.8,N,52,36.7,E,H,-62,,,,,,41.5467,52.6117,5,1750,34,H,162,14/32,ASPH,,,,,,,,,,,CIV,,,Civilian,Very small civilian airport.,
Dashoguz/Khodzhakumbet,"Khodzhakumbet (US), Dasoguz, Tashauz",14 km SW,Dashoguz,Turkmenistan,TKM,,UTAT,,D,M,,41,45.7,N,59,49.6,E,D,272,D,,,,,41.7617,59.8267,5,2700,42,D,90,09L/27R,CONC,,,,,,,,,,,CIV,,,Civilian,Services medium-sized airliners. Runway 09R/27L closed.,
Urgench,,4 km N,Urgench,Khorezmskaya,UZB,,UTNU,,D,M,,41,35.1,N,60,38.5,E,D,322,D,,,,,41.585,60.6417,5,2995,50,D,140,13/31,ASPH,,,,,,,,,,,CIV,,,Civilian,Services large airliners.  24-hour operations.,
Turtkul,,4 km NW,Turtkul,Uzbekistan,UZB,,,,,M,3,41,34.5,N,60,58,E,W,305,W,,,,,41.575,60.9667,5,1503,38,W,27,Feb-20,ASPH,,,,,,,,,,,CIV,,,Civilian,Civilian airfield.,
Pitnyak,,6 km S,Gazojak,Turkmenistan,TKM,,,,,M,2,41,7.5,N,61,24.9,E,W,358,W,,,,,41.125,61.415,5,1700,37,W,6,Jan-19,CONC,,,,,,,,,,,CIV,,,Civilian,Civilian airfield (DAFIF).,
Sugraly,,5 km NE,Zarafson,Uzbekistan,UZB,,,,,M,,41,36.8,N,64,14,E,W,1398,W,,,,,41.6133,64.2333,5,1859,41,W,3,18/36,ASPH,,,,,,,,,,,CIV,,,Civilian,,
Chardara,,2 km N,Chardara,Uzbekistan,UZB,,,,,M,3,41,16.6,N,67,58.3,E,W,709,W,,,,,41.2767,67.9717,5,1637,40,W,40,Mar-21,CONC,,,,,,,,,,,CIV,,,Civilian,Civilian airfield.,
Chirchik,,6 km N,Chirchik,Uzbekistan,UZB,,,,,M,7,41,31,N,69,34.5,E,W,2297,W,,,,,41.5167,69.575,5,2494,32,W,81,"""08""",CONC,,,,,,,,,,,MIL,FA,A,"136 APIB (Su-17,1988) under 49th Air Army (Turkmenistan).  419th Fighter Regiment (32 Su-27).",Large fighter base 34 km NE of Tashkent.  Various revetments along taxiways.  (49th Air Army Turkmenistan),
Tashkent/Vostochny,Tuzel,12 km E,Tashkent,Uzbekistan,UZB,,,,,M,,41,18.8,N,69,23.5,E,W,1575,W,,,,,41.3133,69.3917,5,3240,60,W,82,Aug-26,CONC,,,,,,,,,,,MIL,,,Military,Factory airfield (AviaMK).,
Tashkent/Yuzny,"Tashkent South (US), Yuzhny",7 km S,Tashkent,Uzbekistan,UZB,,UTTT,,CD,M,,41,15.5,N,69,16.9,E,CD,1417,CD,,,,,41.2583,69.2817,5,4000,60,CD,84,08L/26R,CONC,,,,,,,,,,,CIV,,,Civilian,Major international airport with 90 mixed parking spaces and services up to Boeing 747s. Ilyushin reworks facility with many stored aircraft.  (AviaMK),
Karavan,,3 km SW,Karavan,Krgyzystan,KGZ,,,,,M,2,41,28.8,N,71,43.8,E,G,3999,,,,,,41.48,71.73,5,1680,30,G,46,,CONC,,,,,,,,,,,CIV,,,Civilian,Small civilian airfield.,
Naryn,Naryn Northeast (US),11 km NE,Naryn,Krgyzystan,KGZ,,,,,N,2,41,26.5,N,76,7.7,E,H,6978,,,,,,41.4417,76.1283,5,2000,40,H,80,Aug-26,GRAV,,,,,,,,,,,CIV,,,Civilian,Appears to be a minor civilian airfield with a long runway length due to high elevation.,
Gyumri/Kumagari,"Shirak, Leninakan (US)",4 km S,Gyumri,,ARM,,UDEL,,D,M,,40,45.1,N,43,51.6,E,D,5000,D,,,,,40.7517,43.86,5,3220,45,D,24,Feb-20,ASPH,,,,,,,,,,,CIV,,,"Mixed.  121 ShAE (5 Su-25, mid 1990s) (2 L-39, mid 1990s).","Services medium-sized airliners.  Only 10 km from Turkish border.  Terminal area parks 7 aircraft.   S-300 antiaircraft missile systems are based here.  On 02 Sep 1958 a U.S. Air Force C-130 ELINT plane was shot down here, killing 17.  Was UGEL.",
Erevan/Yegvard,Yerevan/Yegvard,,,,ARM,,,,,M,,40,17.9,N,44,33.7,E,G,4501,,,,,,40.2983,44.5617,5,1004,70,G,61,May-23,CONC,,,,,,,,,,,,,,,Added thanks to DAFIF entry.,
Erevan/Zvartnots,"Yerevan/Zvartnots, Parakar (US)",10 km W,Yerevan,,ARM,,UDYZ,,D,M,,40,8.9,N,44,23.8,E,CD,2838,CD,,,,,40.1483,44.3967,5,3850,56,CD,90,Sep-27,ASPH,,,,,,,,,,,CIV,,,Civilian,Handles medium-sized airliners; parks 14 aircraft at circular terminal and 12 at nearby apron.  Large civilian airport (AviaMK).  Listed as UGEE by 1998-2000 Jeppesen and CAICA.,
Erevan/Erebuny,"Yerevan/Erebuny, Erebuni",7 km S,Yerevan,,ARM,,UDYE,,W,M,,40,7.3,N,44,27.9,E,W,2949,W,,,,,40.1217,44.465,5,2784,40,W,33,Mar-21,ASPH,,,,,,,,,,,CIV/MIL,,H,Mixed,"Small airliners.  In 1990s was helicopter base of 15 SAP, with six Mi-24Ks, seven Mi-24Ps (including ""42"" outlinned in white) and two Mi-24Rs, seven Mi-17s and Mi-8MTKs, and two Mi-2s.",
Dallyar,"Dzegam, Sabirkend, Dalyar, Dollyar (US)",4 km E,Zeyem,Azerbaidzhanskaya,AZE,,,,,M,6,40,53.3,N,45,57.4,E,W,1099,W,,,,,40.8883,45.9567,5,2494,41,W,110,Oct-28,CONC,,,,,,,,,,,MIL/CIV,"FA,PVO",IA,Military,Large military base probably serving as interceptor and attack airfield.  No evidence of it being active.,
Gyandzha,"Kirovabad (US), Gandzha",7 km NW,Gence,Azerbaidzhanskaya,AZE,,UBBG,,D,M,5,40,44.1,N,46,19.1,E,D,1083,D,,,,,40.735,46.3183,5,2500,44,D,128,Dec-30,CONC,,,,,,,,,,,MIL/CIV,,TBA,"Mixed.  (1 An-12, mid 1990s), (1 An-24, mid 1990s), (3 Il-76, mid 1990s), (1 Tu-134, mid 1990s).","Significant military facility with 28 bomber pads (presumably for Tu-16 and Tu-22 type aircraft) and two dozen attack revetments.  The runway length does not suggest an intercontinental role.  Civilian terminal on west side parks 4 planes.  In June 1992 the Azerbaijani military took this base by force from Russia, gaining eleven (western sources say 16) Su-24MRs, 20 MiG-25RBs, and three Il-76 transports.  Now is used as a transport base.",
Naftalan,Naftalan (US),2 km NE,Naftalan,Azerbaidzhanskaya,AZE,,,,,M,3,40,31,N,46,49.7,E,G,699,,,,,,40.5167,46.8283,5,1500,30,G,145,,ASPH,,,,,,,,,,,CIV,,,Civilian,Definite civilian airfield; utilitarian layout.,
Evlakh,Yevlakh,2 km N,Evlakh,Azerbaidzhanskaya,AZE,,UBEE,,D,M,2,40,37.9,N,47,8.5,E,G,49,,,,,,40.6317,47.1417,5,1600,35,G,124,Dec-30,ASPH,,,,,,,,,,,CIV,,,Civilian,Poorly maintained airstrip; definitely civilian.  On 02 Apr 1992 a pilot defected to Azerbaijan with a Su-25 from Sital-Chay and landed it here.,
Kyurdamir,Kyurdamir (US),8 km S,Kyurdamir,Azerbaidzhanskaya,AZE,,,,,M,4,40,16.4,N,48,9.8,E,W,-36,W,,,,,40.2733,48.1633,5,2499,40,W,88,Aug-26,CONC,,,,,,,,,,,MIL,FA,AT,"IBAP (12 L-39, mid 1990s), (18 L-29, mid 1990s), (4 MiG-21, mid 1990s), (4 Su-17M, mid 1990s), (3 Su-24, mid 1990s), (2 Su-25, mid 1990s).","Primary Azerbaijani Air Force base, with considerable number of fighter and trainer aircraft.",
Kazi Magomed,Kazi Magomed (US),3 km SW,Kazi Magomed,Azerbaidzhanskaya,AZE,,,,,M,3,40,1.9,N,48,54.1,E,H,-46,,,,,,40.0317,48.9017,5,2000,60,H,150,,ASPH,,,,,,,,,,,MIL,FA,A,Military,Aging military base with attack role; does not appear to be a large facility.  Numerous revetments.  Appears to be nonoperational.,
Sital-Chay,"Sital-Chay (US), Sital Tchaiy",3 km W,Suraabad,Azerbaidzhanskaya,AZE,,,,,M,7,40,48.4,N,49,25.8,E,G,-49,,,,,,40.8067,49.43,5,2500,30,G,170,,CONC,,,,,,,,,,,MIL,,,"80 IBAP (Su-25, 1992).","Large military base; only taxiways and tarmac space; no revetments.  On 08 Apr 1992 Senior Lt. Vagif Kurbanov hijacked a Su-25 from Sital-Chay and flew it to Yevlakh, Azerbaijan, giving the country its first fixed-wing fighter.",
Nasosnaya,"Nasosnyy (US), Nasosny",6 km W,Sumqayit,Azerbaijan,AZE,,,,,M,,40,35.5,N,49,33.4,E,W,-13,W,,,,,40.5917,49.5567,5,2505,40,W,0,17/35,CONC,,,,,,,,,,,MIL,PVO,I,"50 IAP (MiG-25PDS, 1991)[#1].  82 IAP (38 MiG-25), 1980s.","Small base 35 km NW of Baku, with tarmac area and a few revetments.   PVO regiment equipped with MiG-25PDs.",
Sangachaly,Sangachaly (US),7 km NE,Qobustan,Azerbaidzhanskaya,AZE,,,,,M,5,40,7.8,N,49,27.3,E,G,-20,,,,,,40.13,49.455,5,2000,40,G,31,,CONC,,,,,,,,,,,MIL,FA,A,Attack,Military base with numerous attack revetments.  Located along shore of Caspian Sea 46 km SW of Baku.,
